{
  "schema_version": "creative-look.v1",
  "id": "warm_film",
  "name": "Warm Film",
  "description": "Subtle warm negative-inspired look with separated film controls.",
  "tone": {
    "contrast": 0.12,
    "highlight_rolloff": "soft",
    "shadow_lift": 0.04
  },
  "color": {
    "warm_highlights": 0.22,
    "warm_midtones": 0.08,
    "cool_shadows": 0.05,
    "vibrance": 0.1
  },
  "lut": null,
  "film": {
    "grain": 0.12,
    "halation": 0.06,
    "bloom": 0.04,
    "density": 0.18
  },
  "skin_protection": 0.92
}
