{
  "schema_version": "creative-look.v1",
  "id": "clean",
  "name": "Clean",
  "description": "Neutral, restrained output intended for reliable AUTO processing.",
  "tone": {
    "contrast": 0.08,
    "highlight_rolloff": "soft",
    "black_point": 0.02
  },
  "color": {
    "warm_highlights": 0.03,
    "cool_shadows": 0.0,
    "vibrance": 0.08,
    "green_control": 0.04
  },
  "lut": null,
  "film": {
    "grain": 0.0,
    "halation": 0.0,
    "bloom": 0.0,
    "density": 0.0
  },
  "skin_protection": 0.9
}
